{
  "schema_version": 1,
  "presence_status": "missing",
  "comparison_status": "not_compared",
  "promotion_status": "not_requested",
  "baseline_owner": null,
  "comparison_evidence": "No baseline artifact_path provided; observed baseline presence is missing.",
  "current_artifact_ref": {
    "type": "command-log",
    "path": ".harness/evals/runs/20260523T224344Z-pr-closeout-4df36134/command-log.json",
    "sha256": "c79e10dcba11e113d7aac103c3ee21af102855f38d114b4b63ad2a95df1d43a5"
  }
}
